{
  "$schema": "https://json-schema.org/draft/2020-12/schema",
  "$id": "https://github.com/AlanyLourenco/presenca/contrato/v1/presenca.heartbeat.v1.schema.json",
  "title": "presenca.heartbeat.v1",
  "description": "Heartbeat do aparelho do estudante. Reporta o RSSI ouvido de cada âncora da sala e a região de rádio decidida no próprio aparelho (histerese −70/−85 dBm). É o fato bruto sobre o qual o servidor calcula a permanência.",
  "type": "object",
  "required": [
    "eventType", "eventId", "deviceId", "entityId", "aluno", "bootId",
    "eventTimeMs", "sequence", "value", "unit", "state", "ancoras"
  ],
  "additionalProperties": false,
  "properties": {
    "eventType": {
      "const": "presenca.heartbeat.v1",
      "description": "Tipo e versão do contrato. Mudança incompatível cria presenca.heartbeat.v2."
    },
    "eventId": {
      "type": "string",
      "pattern": "^[a-zA-Z0-9-]+#[0-9a-f]{4}#[0-9]+$",
      "description": "Identificação única: deviceId#bootId#sequence. É a chave de deduplicação no servidor. O bootId entra na chave porque a sequência recomeça em 1 a cada reinício: sem ele, o primeiro heartbeat depois de um reboot seria descartado como cópia."
    },
    "deviceId": {
      "type": "string",
      "description": "Aparelho que produziu o heartbeat.",
      "examples": ["apar-01"]
    },
    "entityId": {
      "type": "string",
      "description": "Sala cujas âncoras foram ouvidas.",
      "examples": ["sala-204"]
    },
    "aluno": {
      "type": "string",
      "pattern": "^tok-[0-9a-f]{4,}$",
      "description": "Pseudônimo do estudante. Nunca MAC, IMEI nem nome. No sistema real deriva da chave pública gerada no cofre do aparelho no pareamento; aqui é fixo e não há assinatura."
    },
    "bootId": {
      "type": "string",
      "pattern": "^[0-9a-f]{4}$",
      "description": "Sorteado a cada inicialização do aparelho. Separa as sequências de boots diferentes."
    },
    "eventTimeMs": {
      "type": "integer",
      "minimum": 0,
      "description": "Instante da medição em milissegundos desde o boot. LIMITAÇÃO DECLARADA: não é tempo absoluto. O servidor usa este valor só como posição relativa na linha do tempo daquele boot, e grava o próprio carimbo de recepção."
    },
    "sequence": {
      "type": "integer",
      "minimum": 1,
      "description": "Contador monotônico por boot. Permite detectar repetição, chegada fora de ordem e salto."
    },
    "value": {
      "type": ["number", "null"],
      "minimum": -100,
      "maximum": -30,
      "description": "Melhor RSSI entre as âncoras ouvidas, depois da média móvel. null quando nenhuma âncora foi ouvida."
    },
    "unit": { "const": "dBm" },
    "state": {
      "enum": ["DENTRO_ALCANCE", "FORA_ALCANCE", "INDETERMINADA"],
      "description": "Região de rádio decidida no aparelho. Entra em DENTRO_ALCANCE com melhor RSSI > −70 dBm; volta a FORA_ALCANCE só abaixo de −85 dBm; entre os dois, mantém. INDETERMINADA enquanto a janela de média não encheu."
    },
    "ancoras": {
      "type": "array",
      "minItems": 1,
      "maxItems": 3,
      "items": {
        "type": "object",
        "required": ["id", "rssi"],
        "additionalProperties": false,
        "properties": {
          "id": { "type": "string", "examples": ["anc-204-A"] },
          "rssi": {
            "type": ["number", "null"],
            "minimum": -100,
            "maximum": -30,
            "description": "RSSI filtrado em dBm. null = âncora não ouvida."
          }
        }
      }
    },
    "amostrasInvalidas": {
      "type": "integer",
      "minimum": 0,
      "description": "Leituras descartadas na origem por estarem fora da faixa válida."
    },
    "bufferizado": {
      "type": "boolean",
      "description": "Verdadeiro quando o heartbeat ficou retido na fila local durante a queda de rede e foi entregue depois. eventTimeMs preserva o instante original."
    },
    "anomaliaInjetada": {
      "enum": ["nenhuma", "duplicata", "fora-de-ordem", "salto"],
      "description": "Marca o teste adversarial, só para tornar a demonstração legível. O servidor NÃO usa este campo: detecta a anomalia pela sequência."
    }
  }
}
