{
  "eventType": "presenca.heartbeat.v1",
  "eventId": "apar-01#76fd#21",
  "deviceId": "apar-01",
  "entityId": "sala-204",
  "aluno": "tok-7f3a",
  "bootId": "76fd",
  "eventTimeMs": 18691,
  "sequence": 21,
  "value": -59.4,
  "unit": "dBm",
  "state": "DENTRO_ALCANCE",
  "ancoras": [
    {
      "id": "anc-204-A",
      "rssi": -62.0
    },
    {
      "id": "anc-204-B",
      "rssi": -62.0
    },
    {
      "id": "anc-204-C",
      "rssi": -59.4
    }
  ],
  "amostrasInvalidas": 0,
  "bufferizado": false,
  "anomaliaInjetada": "nenhuma"
}
